{
  "schemaVersion": "1.0.0",
  "workspaceId": "ws_demo",
  "sourceDeviceId": "mac_demo",
  "sourceEpoch": "epoch_demo",
  "sequence": 42,
  "keyId": "key_demo_v1",
  "nonce": "AAECAwQFBgcICQoL",
  "ciphertext": "PCCleK2Ar3rbJOX42IYWT7n0thrAVW9eFEWW63wZc9puZOeYjfsw6xrFD57g6FxnijwN4gXikfgTtVl2bZGWi7RZsBOwtG8FPm6IA47sUYxd56ZAWkEgB4iP_ak9gNbuo9pjxMExp3n2Q1rXJRoDU5gUDd6RpkDJKI4iqOyFCyyBZjLqlrSqI3yUOsRZmzjgDNbRBQcnvnq1cthCruLY1KempCXZpe5ShRS0lLvv8ci_9JFZqcIXnl_9o6gVoM_eYz7jl2yvr-sbdKOU1Tew4IQMsRIfOpiSHvX_v2NkrZsgQLvaiFRKQXB9mmnWchMkxufmEfhd5oc7SQYQ6PM372CQnvn8qWoEVTvKrVOXgOJuEixFN6mtjQBaAiVrv98yIzn8OMiso3bgRRh2KObIsuqvPw4m-6Ne_BMneOJRKcXr4BFD_0JCy9OFCUM4vWlAvzi08e5m4GYq2lpc48Qkk3UNmK_kPR6qQsbISuPMQBKmnGkYh51ho_OAFvD-JTxfxOqusOlgkazSUsRJBnAiq8BqAdTqTib2B36rKiHKmTpwFz4f4es_B8zU8HCOjdHJNB89MCahUoCX1pGZ4889VFgJwajcNNowjm6IOJW273MF5Qgzr8VsTCDnlpJ3mvLXcaBcdfT8sqtzkCbig47Bov_Oov9P2IRE9nazZ-XaYy6XQdrBkgHpA3GK20kLKFGI3ZAXGB0Ps9jqJDQVjXYsgF45G7fVaoA-ZORmnP9eYd129bUTj7IdC26IXeKwW6g6GoOuLA4iUSWoxdKhqLop8nX36t1656KK1WDUwVD6EeyPcKca9lXH4lTpqPBREvRvW6F0HwKRieY2Ij1G7-WdGRXrvXDs4TTzZaseQ4ZMTOBMR6uDKhumwXDjktTlsaj5uaZ3Fyh7JH6bB7jeayhd4CYl54dVo6-aqr9HTrEZf3UHl-9xe0zvUQ9wM9e4jwe9IjAcOso5vZC8mvTPzaLq5JxiD_3B9xTjJ_vTNsDqLJp5IUACwy2NhdON2OipDvToqZtyf_Q54cesqGCVDjn3h-KvGEefutf1EpS7Y7Gf67TL8TRlBKVvqXrF_O6FDAG_xjhwhUejrOADI_SeDH-QmgfCA1qQnLHurZqW7L9m3OJnoFdvfDPCTgYCgozCPZ3MczqKedLm7ivo-IRu4QN61_q_3y-HAK315d-SVP78ZYYz8o3__poeDisKsfR9C70XWo1871XRo9l5i6REraQap93UFgBUj6OBcRwAQ6wgRFKvkTq3alzU14ZXyF1weRuIXXrrf9RzlK1tpZQn6TtnsGYEAf_WOnIUYoDsH52Lnn220I58MdwZRLjALpsutms_ptnNlzoBBxr7ijr__jg65t7c0LlXEiqSAqCgnntrw-tOif5wWN_bJdh0lR9xarAJXNkxvjtkkUCQEOGwr98OuVykbZPbSa2CaxNrqe9a1uaIlI9RIORgOjpaNw_dFi9MJ7vBfMvWfw4z65PTEXkrYmooeEJ2mbN1-tGoNE6RC_Vt8jgrQ9iai1YZSHp3_Jg1SU4zLZ6nSqUSnxuTgS4bKxKxzuv2-cyTZhx7aW3wg3XI99-lJz4a14JGzlRiyg",
  "tag": "heSNfjBjPC8eg2Yh9rTDyA",
  "signature": "_vLTQ2KVa0_DNMSsBSGClQA87zZOI9hu2HpI1O1ExZ0_5fRhn3XiuElU1M78U26cO98KXc7PFWzSxNqpPzn8Dw",
  "contentHash": "d8932161774c4d87e06e4a5fb49a3e3f1ae9125e1aa132291e7dc537c6242262"
}
